minwon_title,minwon_content,minwon_type,minwon_department
 성수가동 주민자치회 운영에 관하여, 안녕하세요 연일 성동구 발전을 위해 힘써주시는 관계자 여러분 노고가 많으십니다많은 수고와 노고 덕분에 성동구에 많은 변화와 지속적인 발전에 감사드립니다다름이 아니고 최근 코로나로 주민자치회 위원들의 대면회의가 이루어 질 수 없어 년 월 부터 화상회의로 주민자치 활동을 하고 있습니다모두가 코로나로 정신적 금전적으로 어려움을 겪고 있지만 주민자치회 위원이라는책임감에 익숙지 않은 화상회의를 시간내어 배우고 습득하여 적응하고 있는 상황인데저희 성수가제동 주민자치회에서는 이런 상황에서도 많은 위원님들께서 따로 시간을 내어 스마트폰 작동 방법을 배워가며 잘 적응하시고들 계십니다월 일화 저희동은 올해 들어 번째 화상회의가 이루어졌습니다이번 화상회의에서는 현재 주민자치회 회비를 지속적으로 걷어야할지의 여부를 안건으로 상정해 화상회의가 진행되었습니다이 과정에서 현재 성수가제동에서는 위원들에게 매달 만원이라는 회비를 걷어만원이라는 회비가 있는 상황이고 코로나로 모두가 어려운 상황에서 회비를지속적으로 걷지 않아도 되지 않느냐는 다수의 의견이 있었습니다실제로 년에도 과도하게 걷은 회비가 결산때 너무 많이 남아 쓸대없는 곳으로지출을 한 경험이 있기도 했었습니다또한 회비를 지속적으로 걷어야하는 명확한 이유와 집행 될 예산을 제시해 달라는위원의 건의도 무시한 채 회장님은 회칙에 정해져 있는 것이니 더이상 회비를 내는 것에대해 불만을 갖지 말고 내주시라고 막무가내로 말씀을 하셨습니다여기다 회비를 지속적으로 내는 것에 대한 찬반 투표를 하는데 년도에 회비를완납하지 않은 위원들은 투표를 할 수 없다고 하시며 그 분들이 모두 회비를 낸 후찬반 투표를 진행한다고 언포를 놓으셨습니다물론 저는 회비를 모두 완납한 상태지만 회장님이 어떤 권한으로 개인적인 사정으로못 낼 수 도 있는 분들께 저런 모멸감과 박탈감을 주는 언행을 공개적으로 하시며 본인이 어떤 자격으로 그 분들의 투표권까지 공개적으로 박탈을 할 수 있을까해서회장님께서 그분들의 투표권을 박탈할 권한은 없다고 까지 말씀드렸지만 막무가내로그렇게 하시겠다고 하고 회의는 종료되었습니다여기다 회장님과 매우 친하신 위원님께서는 회비를 안내신 분들은 올해 위원 활동을그만두실꺼냐고 까지 단도직입적으로 말씀을 물으시며 그 분들을 공격했습니다성수가제동에서는 이런 일들 뿐만이 아니고 지속적으로 회장님께서 위원님들과의소통이 이루어지지 않아 항상 문제가 일어나고 있습니다전에도 위원님들께 공개적으로 본인의 집행들이 마음에 안들면 위원을 사퇴하라는 발언은 공개적으로 하셔서 문제가 되었었는데 이번에는 주민자치회비 납부를 강요하고 그에 따라 위원에게 투표권을 주지 않겠다는말을 공개적으로 하여 분란이 되고 있습니다회칙에 있다는 이유로 이런식으로 회비의 강압적인 납부 요구와 소통 부재 및 위원들에게지속적으로 상처를 주는 모습은 옳바른 회장의 모습이 아니라고 생각되오니 성수가제동의 이런 회장님의 자치회 운영에 대한 시정조치를 부탁드리겠습니다긴글 읽어 주시어 감사합니다,행정관리국 자치행정과,행정관리국
 입주자대표회의 운영비에 대한 문의 및 요청, 본인은 성수동아이파크아파트에 현재 년차 거주하는 입주자입니다최근 아파트 관리규약을 단지 내 홈페이지를 통해 알게 되었습니다관리규약으로 정한 입주자대표회의 운영비 구성 중   영 제조제항에 따른 운영 및 윤리교육비  매월 만원 년간 교육비 발생금액관리규약 제조 제항제호에 대하여 아무리 규정 및 시행령을 수십번 읽어보아도 입대의 구성원들이 년간 교육을 어디에서 얼마의 비용을 들여 받는지 매월 만원 곱하기 개월 만원의 비용이 발생하는지 이해가 되질 않습니다 주택괸리사 자격증을 소지하신 관리소장의 전문적인 설명을 듣고 싶습니다 라고 하면서 관리소장에게 아래와 같이 문의하였고 소장도 답을 하였습니다 입대의 운영비는 규약에 정해진 대로 관리주체는 매월 월초에 업무추진비회장 감사 및 이사와 운영 및 윤리교육비월 만원를 입대의에 지급하고 회의 수당은 회의 개최 이후에 참석자에 한하여 참석 수당을 지급하고 있지요관리소장  네 그렇게 하고 있습니다 운영 및 윤리교육비월 만원는 어떤 용도로 사용하여야 합니까관리소장  제가 답변을 드리는 것은 적절하지 않은 것 같습니다그래서 이번에는 우리 아파트 관리의 감독기관인 성동구청에 문의 합니다운영 및 윤리교육비월 만원는 어떤 용도로 사용하여야 합니까공동주택 관리규약은 공동주택법 제조관리규약의 제정 및 개정 등 신고에 따라 귀청에 신고되어 있을 것입니다규약 규정에 분명하게 공동주택법 시행령 제조제항에 따른 운영 및 윤리 교육비라고 명시되었습니다 즉 법령에 따라 입주자대표회의 구성원들은 의무적으로 년에 시간의 교육을 이수하여야 하고 그 비용은 입주자대표회의 운영비에서 부담하도록 하였고시행령 제조 성동구청도 이와 관련된 교육을 실시하고 있습니다첨부돤 관련 가사 파일 참조관리규약 제조운영비 제항에 의하면 관리주체는 운영비사용규정에 따라 입주자대표회의에서 제출한 사용내역을 매월 별도의 장부증빙자료를 포함한다로 작성하여 년간 보관 및 관리하여야 하며 다음달 말일까지 게시판 통합정보마당에 공개하여야 한다라고 되어 있음에도 최근까지 공개되어 있지 않아 본인의 요청에 따라 년도 사용내역만 단지내 홈페이지에 최근 공개되었습니다관리규약에 첨부된 성동아이파크아파트 입주자대표회의 운영비에 관한 사용규정안제조 운영비 사용내역보관 및 공개 관리주체는 입주자대표회의에서 제출한 사용내역을 매월 별도의 장부증빙자료를 포함한다로 작성하여 년간 보관 및 관리하여야 하며 다음달 말일까지 게시판 통합정보마당에 공개하여야 한다 그럼에도 년까지 공개하지 않아 법령 및 규약을 위반한 것입니다더욱 놀라운 것은 그나마 최근 공개된 관리주체의 년분 운영비 지급 내역과 입주자대표회의가 작성한 운영 및 윤리교육비월 만원로 받은 금원에 대한 사용을 보면첨부 내역 참조 단 한 번의 교육비 관련 지출은 단 하나도 없으며 대부분 입주자대표회의가 있는 날 간식비 명목으로 사용하였으며 심지어 입대위 구성 자녀 결혼 화환 비용을 사용하기도 하였습니다 또한 성동아이파크아파트 입주자대표회의 운영비에 관한 사용규정안제조 운영비의 기준금액에 의하면 항 총 운영비는 세대당 월 원을 초과할 수 없다항 교육비는 시행령 제조제항에 따른 입주자대표회의 운영과 관련하여 필요한 교육 및 윤리교육에 교육주체가 교육비 납입이 필요한 금액으로 하며 주택관리 관련 전문가 자문 시 자문비와 실비를 지급할 수 있다라고 규정하면서 제가 받은 년 월분 부과내역서에는 대표회의운영비로 원이 부과되었습니다 관리규약과 운영비 사용규정을 개정하지 않고 관리주체는 부과내역서를 작성하고 입대의는 검토 없이 이를 의결하는 그들에게 업무추진비 회의참석비 등 비용을 입주자등은 조건없이 납부하여야 합니까 이런 경우는 어떻게 처리하여야 하는지 감독하는 구청에서 조치하였으면 합니다우리 단지 입대의 구성원은 명입니다 지난 회 연속 입주자대표회의를 방청해보니 회의 석상에 놓여 있는 것은 작은 생수병 하나뿐인데도 불구하고 회의 간식비라는 명목으로 명이 참석한 날에 간식비가 만 원도 있고  만원도 있고 몇 명이 모였는지 모르는 간담회에서도 여만 원을 사용하기도 하였습니다이와 같은 비용이 회의 간식비라고 누가 인정하겠습니까 이는 코로나 상황에서도 교육비로 책정된 운영비를 자기들 회식비용으로 사용하였다고 아니 볼 수 있겠습니까나름대로 공동주택관리 법령과 서울시 관리규약 준칙 및 이와 관련된 수많은 언론기사 등을 검색하여 접하면서 다음과 같이 정리해 보았습니다 입주자대표회의 운영비는 관리비부과 내역 중 사용료이다  입주자대표회의 운영비 사용내역은 매월 공개하여야 한다하지 아니함 입주자대표회의는 사용료인 입대의 운영비를 법에 따른 용도 외의 목적으로 사용하였다공동주택관리법 제조제항 위반 제조제항을 위반하여 관리비사용료와 장기수선충당금을 이 법에 따른 용도 외의 목적으로 사용한 자는 천만원 이하의 과태료를 부과한다 공동주택관리법 제조과태료감독기관으로서 정당한 조치가 필요합니다입주자대표회의 운영비 관련 문제 외 관리규약과 선거관리규정 위반사례가 있습니다년 월 일 입주자대표회의의 임원회장과 감사 선거 투표가 있었습니다월 일 오후 시경 제가 거주하는 동의 동별 대표자가 제집을 방문하여 특정 후보에게 투표하라고 선거운동을 하길래 바로 투표장에 가서 선거관리위원들에게 자필로 선거규정을 확인한 후 위반사항을 적시하고 자필 서명하여 신고하였습니다위반사항은 선거운동 기간에도 금지된 호별 방문과 선거일에는 후보자도 선거운동을 금지하고 있는데 동별 대표자라는 분이 선거 진행 중에 가가호호 호별방문하여 특정 후보를 찍으라는 행위를 하였습니다 요즘 초등학생도 이 정도는 알 것입니다이후 선관위에서는 당사자에게 사퇴 권고를 하였다고 하는데 그 후 지금까지 아무런 논의도 없고 당사자는 회의에 참석하고 있습니다 이럴 경우 저는 어떤 절차를 밟는 것이 정당한 것인지 알려주시면 감사하겠습니다 상식과 법치가 살아 있는 곳에 살고 싶습니다 도와주십시오 첨부파일   년도 입주자대표회의 운영비년도 입주자대표회의 운영비 입대의 운영 윤리교육입대의 운영 윤리교육,도시관리국 공동주택과,도시관리국
 성동보건소 코로나검사결과 통보 누락 시정요청, 안녕하세요 코로나 밀접접촉자로 분류되어 지난 일부터 지난 주말까지 자가격리한 사람입니다자가격리 해지 일 전 검사 하라고 전달 받아서 일 성동보건소 방문하여 오전에 검사진행하였습니다신원정보 명확히 기재된 것을 확인하였는데 금일 오전까지 결과 통보 문자를 받지 못하였습니다보통 일 정도 소요되기에 토요일에 결과가 알고 싶어서 보건소 연락했으나 계속 통화중이라 연결이 안되었고어제 연결이 되었을 때는 아직도 결과가 넘어오지 않아서 또 기다리라고 했습니다그런데 오늘 같은 번호로 확인했을때는 다른 담당자 검사확인 담당문자발송업무 하시는 분을 알려주셨는데그 분한테 확인해보니 제 결과가 이미 일에 나왔다고 하더라고요 결과 문자를 왜 화요일 오전까지 못 받은 걸까요음성결과를 제 주위사람들 또한 계속 기다렸습니다 문자는 제가 전화하시는 분한테 재촉해서 받았습니다다음부터는 명의 누락없이 업무 처리 부탁 드리며 이렇게 일이나 소요되게 될 경우 미리 사전 안내해주세요한 마디 사과도 없으니 더 황당합니다 형평성 있게 업무 처리해주세요,보건소 질병예방과,보건소
 한양대 엔터식스 상가의 아파트 통로 및 출입구의 일방적인 통제로 불편합니다, 안녕하세요서울숲더샵 주상복합 아파트 입주민 입니다현재 서울숲더샵 아파트와 연결된 지하 상가엔터식스 한양대점에서 리뉴얼 명목으로 모든 입점상가를 내보내고일부 통로를 통제함으로 입주민의 이동 동선에 불편함을 초래해서 시정 안내 요청 드립니다주상복합 아파트의 특성상 아파트와 상가가 유기적으로 연결되어 있고 상가에서 아파트 출입이 가능하도록 되어 있는데상가 내부를 일방적으로 통제하여 상가내 편의시설로의 접근성을 떨어트리고 있으며상가 내부 동선으로 편의시설 접근 불가 그로 인해 불편함을 초래하고 입주민들의 많은 불만을 사고 있어 시정 안내가 필요한 상황입니다코로나로 인한 경기 상황에 따라 입점된 상가가 폐업하는 상황도 안타까운데 이동 동선까지 불편하도록 통제를 통보하고 입주민에게 불편함을 감수만 해달라고 하는 상황이 이해가 되지 않습니다더불어 리뉴얼을 진행한다고 해도 리뉴얼에 대한 일정이나 계획 안내도 없습니다아파트 관리사무소에서도 해당 내용에 대한 파악이 되지 않고 있으며 지하 상가부 임대를 준 포스코에서도 통으로 임대를 준 상황이라며 책임을 회피하려는 태도 입니다포스코에서 엔터식스에 상가를 통으로 임대를 줄 때에도 계약사항에 아파트 입주민의 불편 초래는 없어야 한다는 조건 등이 없었는지 확인할 방법이 없어서 도움 요청 드립니다포스코와 엔터식스 아파트 관리사무소에 정확한 사실과 계획 확인을 통해 입주민에게 안내될 수 있도록 확인 요청 부탁드리겠습니다감사합니다,도시관리국 공동주택과,도시관리국
 재활용정거장 운영 불편사항, 재활용정거장 취지가 무엇인지도 궁금합니다아주머니 두분이 나와서 집에서 나온 재활용 쓰레기 비닐 플라스틱류를 내다버린 그자리에서전부 풀어헤쳐서는  이건 되네 안되네 하며 하시는것도 당황스러웠지만 추후 다음부턴 버리지 마세요가 되어야 되는데이건 안되니 다시 들고 들어가세요 하며 쓰레기를 그자리에서 손에 쥐어주시던지 이건 버리면 안된다며 짜증을 낸다던지사람들 다보는 앞에서 망신살 당하고 왔네요 급히 나가봐야해서 나온건데 쓰레기봉투를 하나 건네며 가져가라시길래빨리 가봐야해서 받을 수가 없다니까 주머니에 넣어가면 되지 않냐며 또 짜증을 내시네요죄송하지만 빨리 가봐야해서 일단 가봐도 될까요 했더니분류를 잘했는지 못했는지 확인 될때까지 그자리에서 분이고 분이고 기다리라고 하시더군요또 나가는길에 집앞에 버려진 다른 호수의 재활용쓰레기도 같이 들고나가서 재활용정거장에 가져다놨는데그것까지 풀어헤치시고는 이거저거 안된다며 가져가라길래 이건 제가 버린게 아닌데 일단 이쪽으로 가져나온거에요라도 했더니 일단 가져가라십니다 수고하시는건 알겠습니다만 스트레스 받아서 송정동에서 살기가 싫어집니다어느 누구에게 물어봐도 이렇게까지 본인이 들고나온 쓰레기를 풀어헤쳐서 되네안되네핀잔주는 동네는 없는 것 같네요 쓰레기 봉투가 있으시면 그자리에서 쓰레기는 걸러내시던지 제 나름대로 집안에서 비닐과 재활용품 인터넷 검색까지 해가며버리는데 그와중에 판단오류로 인해 쓰레기가 섞여 들어가곤 합니다만 왜 이렇게까지 해서 스트레스를 받아야하는지이사가야하는지 고민이되는 와중에 글이라도 써봅니다,복지국 청소행정과,복지국
 목록번호  방송설비 사업자 선정에 관한 사항의 답변과 관련하여, 귀청 답변에 감사합니다답변에 의하면 관리주체에 민원사항을 통보하고 향후 아파트관리 시설공사 및 용역 등 사업자 선정 시 충분한 기간을 두고 관련법령 및 지침을 통해 진행할 것을 행정안내 하였다고 하였습니다 이에 대하여 아래와 같이 문의하오니 답변주시면 감사하겠습니다 이러한 민원사항 통보 및 행정안내의 경우 관리주체에 어떤 방법으로 통보하고 행정안내를 하십니까 문서공문로 하십니까 아니면 전화로 통보라고 안내하십니까 만일 문서로 통보 및 안내하였다면 관리주체는 그 내용을 입주자대표회의 및 입주자등에게 게시판 및 단지 내 홈페이지에 공개하여야 하는 것이 맞지 않겠습니까 현재까지 이와 관련된 사항이 공개되어 있지 않기 때문입니다,도시관리국 공동주택과,도시관리국
 개월안에 세입자를 모두 내보내고 용도변경 공사를 완결하는것은 불가능합니다, 얼마전 구청 건축과에서 시정명령서를 받았습니다주택용도로 신고되어있지 않은것을 주택으로 사용하고 있다는 민원으로 인한 시정명령이었습니다집을 상업적으로 사용하려고 생각해본적도 없기 때문에 그 집을 짓고 년을 처음 집을 지었을 당시 그대로 현재도 살고 있습니다당연하게 주택으로 신고가 되었있을것이라고 생각하고 살았는데이번에 처음 알게되었습니다건축업자가 돈을 좀 더 벌기 위해 저희를 속이고신고도 허위로 했다는 사실을요그래서 구청 담당자에게 어떻게 해야 하는지 문의를 하러 직접갔었지요현재 살고 있는 세입자를 내보내고 공사를 해서 용도변경을 해야 한다고 하더군요그래서 건축사도 찾아가서 알아보고 하는 중입니다그런데세입자들을 내보내고 건축사를 써서 공사를 하고 구청에 신고하는 일이 말한다고 바로 되는 일은 아니잖아요우선 가장 큰일은 세입자를 내보내야 일을 진행할 수 있는데계약기간이 남아있는 세입자에게 무조건 나가달라고 하는것도 문제지만당장 나갈 수 없다고 버티는 세입자를 저희가 쫒아낼수도 없는 일 아닙니까더군다나 지금 아직도 종식되고 있지 않은 코로나로 힘든시기와 겹쳐 기록적인 한파로 더욱 많이 힘든 시기입니다처음 구청에 찾아가서 문의를 했을때 담당자인 건축과에 백씨는 집에 가서 세입자의 계약서를 확인하고 의논한 다음에 연락을 주면 기간을 조정해 주시겠다고 했습니다그래서 어느 정도의 시간은 주실것이라 생각하고 의논을 한 끝에 전화를 했는데 담당자가 바뀌었다고 재차 연락한 끝에 박담당자와 연락이 됐지만 줄 수 있는 기간은 달이라고 하더군요제가 현실적으로 그 안에 해결을 할 수는 없는 기간이 아니냐고 되물었더니계속 같은 말만 되풀이 하시면서 달까지만 기간을 줄 수 있다는 것입니다달안에 모든세입자를 내보내고 공사를 진행을 할 수는 없으니 기간을 더 줄수는 없느냐는 물음에도 계속 달까지만 줄수 있다였습니다처음 저와 아버지가 구청에 다녀와 이런 사실을 알게되신 후 아버지는 입맛이 없으시다고 밥을 제대로 못 드시고 몸살이 나고 원래 몸이 아프신 어머니도 스트레스성 장염이 오셔서 몸져 누우셨습니다년동안 사기를 당했는데도 모르고 살다가 이제와서 이런 사실을 알게되셔서 망연자실한 가운데 구청에서 일하시는 담당자들께서는 현실적인 상황은 고려하지 않은채 앵무새처럼 똑같은 말만 반복하고 있다는것이 답답합니다정말로 이 추운 한파에 세입자들을 내쫒고 기간안에 용도변경 공사를 진행하는 방법밖에 없는 건가요정말로 좀더 시간을 줄 수는 없는 건가요저는 지금 어머니가 너무 걱정스럽습니다년째 병중에 계시는데 이번일로 정신적인 스트레스를 너무 받으셔서 잘 못되실까봐 너무 걱정이 됩니다제발 시간을 더 주세요,도시관리국 건축과,도시관리국
 금호동 가 공공재개발, 성동구 구정에 항상 노고가 많으신 구청장님께 너무도 감사드립니다 오랜시간 다른지역에서 거주하다 이곳에서 생활하다보니 초역세권에 금남시장등 상업지역 많은 학교등으로 인한 교육특구등 왜 마용성이라는 말을 하는지 알게 될 정도로 거주에 만족하고 있습니다 단지 아쉽다면 월 초순 갑작스런 한파로 보일러가 동파되어 설비업체를 불렀지만 고칠수 없었습니다 지역적으로 도로가 협소하여 정비업체차를 주차할수도  없었을뿐 더러 일하다 말고 계속 주차를 옮겨야 하는 상황으로 금호 구역 주변은 그야말로 차가 한대만 올라와도 공포입니다 할수없이 본인이 장시간 외부에 서서 해동할수 밖에 없었습니다 주택이 노후화되어서 지붕수리나 긴급상황에도 수리업체에 부탁하려면 주차로 인해서 사정사정하며 눈치를 보아야 합니다 오늘 신문에 나오듯 마용성 중에서  저희 성동구의 경제 건강 복리 주거여건 도로망 주차장 안전소방차등 화재 대응수준 여건이 제일 낮게 나온것을 참고하시어  왕십리 천지개벽 신금호역 신흥부촌 등을 이끌어 내신 역량과 경험으로 저희 금호동가의 공공 재개발도 거주민의 절반이상의 염원을 기억하시어 성공적으로 이끌어 주시길 간절히 부탁드립니다,도시관리국 주거정비과,도시관리국
 공공청사 공사 너무 시끄럽습니다, 저희 집 바로 옆에 공공주차장이 있었습니다 지난해 말 부터 주차장을 공공청사로 바꾼다고 했는데 공사 소리가 너무 시끄럽습니다 저 같은 경우는 교대근무를 하는 사람으로 낮에 자야하는 경우가 많은데 잠을 잘 수가 없습니다 시끄러운 소리에 대한 대책을 마련해주세요 민원 쓰고 있는 도중에도 소리가 너무 커서 집이 울리고 있습니다,스마트포용도시국 맑은환경과,스마트포용도시국
 사망신고 하는 곳 문의드립니다, 할머니가 돌아가셔서 아버지가 사망신고를 하려하셔서 알아보다 문의드립니다할머니의 주소지는 충남 청양입니다그리고 동거 중인 가족도 없고 아버지가 장남이시며 성동구에 거주하고 있습니다이 경우 사망신고를 시골의 면사무소에 가야만 할 수 있는 것인지 아니면 멀리 가지 않고도 할 수 있는 것인지 궁금해서 문의드립니다,행정관리국 자치행정과,행정관리국
 옥수역 공영주차장 공사 관련 정보 부탁드립니다, 안녕하세요 옥수동의 발전을 위해 얼마 전에 옥수역 바로 옆 수도정화시설에 공영주차장 시공식을 시작으로 계속 공사가 진행 되고 있는 것을 바로 앞에 사는 주민으로 매일 보고 있는데요 오늘 아침 시부터 지금 오전 시가 넘어서까지 엄청난 타공이 끊임없이 계속되고 있습니다 큰 중장비가 바닥에 뭔가 구멍을 뚫고 있는거 같은데요 ㅜ 이 공사가 연말에나 끝나는 걸로 알고 있어서 매우 두려운 상태입니다 하루종일 재택근무로 집에 있는데 이렇게 극심한 소음이 언제까지 계속될건지 최대한 자세한 공사 내역을 알려주세요 같은 아파트에 인테리어 공사를 해도 주민들 동의 얻고 소음발생일은 언제부터 언제까지라고 공지를 하니 주민들께 일일이 알려주시긴 힘드시겠지만 구청 홈페이지나 어딘가에 공지하시면 주민들에게 큰 도움이 될 꺼 같아요 저도 아침부터 머리가 깨질꺼 같은데 아이 키우는 집이나 노인분들은 더 힘드실 것 같습니다 가뜩이나 옥수역에 지하 터널 공사 때문에 시시때때로 계속 소음이 발생하고 있는 상황인데 주차장 공사까지 힘들어서 문의드립니다 감사합니다,안전건설교통국 치수과,안전건설교통국
