minwon_title,minwon_content,minwon_type,minwon_department
 용답동 도시재생이 아닌 주거환경 개선을 위한 전면 정비사업 요청,  용답동 대부분의 주택과 건물들이 년 이상된 노후화된 상황인 것을 구청은 알고 있는지요   타 구청에서는 주민들의 주거 환경 개선과 집값 안정 등을 이유로 재개발을 적극적으로 지원하고   있는 것에 반해 성동구는 언제까지 용답동을 이런 상태로 방치할 것인지 궁금합니다   용답동이 왕십리와 답십리에 비해 이렇게 노후화된 채로 남게 된 것은 전통시장에만 치우친   행정 때문이라 생각합니다    상가 주변에 사는 주민들의 불편은 고려하지 않고 빛 공해 소음공해 등에 대한 대책 없이   동네 입구에도 로데오 대형 간판을 설치하도록 허가하고 길가에 무분별하게 설치된 입간판들   조차 관리하지 않는 구청의 입장이 궁금합니다  구청 담당자들에게는 용답 푸르미르 상가협회   사람들만 보이시나요 일반 주민들은 역차별을 느낍니다  도시재생과 같은 소극적인 대응말고 년 노후화된 주거 환경을 어떻게 개선하게 할 것인지   어떻게 하면 용답초등학교에 학생들이 넘쳐 나고 젊은 사람들이 유입되게 할 수 있는지 보다   근본적이고 현실적인 고민을 바랍니다 주거 환경의 노후화 주차문제 쓰레기문제 소음문제로   더이상 원주민들이 마을을 떠나지 않도록 제발 현실적인 대책을 마련해 주시기 바랍니다  오세훈 서울시장은 공공기획을 적용한 민간재개발을 유도해 정비사업 활성화를 적극 추진하고   있습니다 용답동은 이 사업에 가장 적합한 장소이며 공급난 해소라는 명분도 같이 얻을 수 있을   것으로 보입니다,도시관리국 주거정비과,도시관리국
 성동구 쿠팡 위생문제, 서울 성동구 뚝섬로길 해당 주소지에 있는 쿠팡 물류창고에 인도와 붙은 곳에 쓰레기를 모으는 공간으로 활용해서 그곳을 지나갈 때마다 악취와 간혹 쥐들이 보이기도 합니다 너무나 비위생적이어서 지나갈 때마다 혐오감이 듭니다,복지국 청소행정과,복지국
 공공공사 일시 고지 부탁드립니다, 안녕하세요 서울숲 길은 너무 많은 공사로 거주민과 사업장이 많이 힘들어 하고 있습니다 적어도 일전에 진행된 상수도 공사나 오늘 진행되고 있는 도로 공사 등은 미리 안내를 주셔야 차량의 이동이나 업장운영에 지장이 없습니다 오늘 같은 날도 업장은 쉬지만 업장 사업자들은 나와서 일을 하거나 물건을 받거나 여러가지 업무가 있는 날입니다 미리 알았다면 차를 다른 곳에 대거나 물건 수령에 어려움이 없었을것 같습니다 부디 우편함에 작은 쪽지라도  미리 공지나 안내를 꼭 좀 부탁드립니다,  연계처리내역    민원상세보기원본 추천기관  서울특별시 이송추천사유  동부수도사업소 공사로 재배정요청 담당자탁기홍 연락처 처리상태  이송이첩 아래 답변이 안보일 경우 위의  민원상세보기원본을 클릭하여 확인해 주시기 바랍니다  연계된 기관에서 처리한 내용으로 궁금하신 사항은 해당 기관으로 문의해야 합니다     ,이송이첩/다부처병렬
 경유냄새가  부엌 안방까지 납니다  바로 옆집이 정비소를 해요, 저희 옆집이 정비업을 하고 있어서경유냄새가 부앜에서 안방에서  진동을 합니다송정동에는  저희 옆집에 이상하게 자동차 정비업소가 있는데원래 그집은 가정집과 겸용해서  미술학원 정육점을 하던 곳이었고원칙적으로는 본래 가정집이었습니다새로 이 사온 사람이 허가 받아 사업을 하고있는데  말도 못합니다   밤에 자는데 경유냄새가 진동을 하고 부앜에서도 나네요경윤냄새가 진동해서 밤에 잘때 경유냄새가 심하게 납니다부엌에서 안방까지이 동네 살아온지  년에 거주하여 지금까지 쭈욱 살고 있는 거주자 입니다냄새가 난다구요경유냄새가  옆집은 주변은  송원피아노 그 뒤에 아이파크가 있습니다주택가 거주자들이 사는 곳입니다남에 동네와서  이렇게  옆집에 피해를 줘도 되는 나라가  바로  대한민국 입니까그렇게 옆집에 경유냄새가 진동하도록 사업을 굳이 해야함 합니까송정동에 자동치 정비하는 곳  바로 저희 옆집인데  웃기네요원래  한 곳도 생겨서는 안되는데 그것도 바로 저희 옆집부엌에서  안방까지 경유냄새가  진동하는 바람에  올 여름내내  고생했구요지금도 월 일 새벽부터 지금까지 줄 곧 경유냄새 진동 했구요또 답변 가봤더니 아무것도 없고  모르겠다하시고   구렁이 담넘어 가시는 답변 하시려면아예  그런 정비사업을 왜 승인을 해 주셨냐구요거주자 우선이 먼저인 나라가 대한민국 아닌가요정비업은  원래 주거지 경우에는 허가를 내주시면 안되는 걸 모르시나요냄새나고 경유냄새 진동하고  저희집  올 여름내내  경유냄새 나니까그렇게 해서라도  못살게 하고 이사가게 한 다음  이동네 개발업자에게 넘겨서 개발하시게저희집에 저희 어머니와 달랑 저 딱 둘이 사는데뭐 만만해 보이는 모녀집안  잔머리 굴려서  경유냄새에 질식시켜 뭐 죽여 버리기라도 해야겠다는 거냐구요그렇게 해서라도 먹고 살게 해 주시는 성동구청개나소나  아무곳에다가  자동차 정비업소 차리고 돈이나 벌고 세금 내면  장땡이다 저한테 전화하지 마세요경유냄새 안나도록  이사를 가시거나  업종을 바꾸시거나왜 주택가에  정비업소가 있나요  경유냄새 때문에 잠을 못자고  책도 제대로 읽지를 못하고 집안에 머무는 동안  곤욕입니다경유냄새 나는건 자랑이 아니죠이건 뭐 드럼통 소리 나고  경유냄새나고딱 봐도이건 뭐   목적을 갖고 작심하고 이 동네로 이사 온 것 같은데버젓이   정비소 허가 해 준 구청도 왕 웃김,안전건설교통국 교통행정과,안전건설교통국
 디노체 웨딩홀의 보증인원 강매행위를 신고합니다, 안녕하세요 디노체 웨딩홀에서 결혼식이 예정된 신혼부부입니다최근 웨딩업체들의 제공되지 않는 식사인원에 대하여 보증인원제도를 악용하여예비신혼부부들에게 싸구려 답례품을 강매하는 행위가 각종 매체에서 보도되고 있는데요디노체 웨딩홀 또한 이런 강매행위를 지속적으로 유지하고 있습니다디노체의 강매행위로 인한 피해자들의 모임도 있는데 현재 명이 모여있고 강매로 인한 피해금액만 최소 인당 만원 이상의 수준으로 총액으로 계산하면 억단위의 피해가 발생하는겁니다코로나 방역 단계 연장으로 인하여 식사가 제공되지 않는다면 명까지 웨딩홀 입장이 가능한 사항임에도 불구하고디노체 측에서는 명명 분의 답례품을 준비하여 보증인원에 해당하는 금액을 철저하게 받아내겠다는 겁니다최대 명까지 입장 가능한 웨딩홀에서 명 분의 답례품을 준비하여 하객들이 받아가게끔 하는게 방역수칙에 위배되지 않는 사항입니까홀 입장이 명까지만 가능하다면 답례품도 명분만 지급이 가능해야하는 것이고 그렇다면 보증인원도 웨딩홀에서 지급 가능한 답례품 수량까지 줄어들어야 하는 것이 당연한 것 아닙니까명까지 입장 가능한 현 방역 지침에서 명 가량의 하객이 방문하여 답례품을 수령하는 것이 방역지침을 위반하지 않는 것인지 그리고 디노체 웨딩홀의 경우 동선이 분리된 곳인지에 대한 성동구청의 공식적인 답변을 원합니다,복지국 여성가족과,복지국
 잡초제거 문의, 사근삼거리에서 살곶이 체육공원으로 이어지는 살곶이길 도보가 잡초가 너무 자라서 거의 밀림입니다교행이 힘들 정도고 따릉이 이용 시 특히 불편해요잡초랑 나뭇가지 제거 부탁드립니다,  연계처리내역    민원상세보기원본 추천기관  서울특별시 이송추천사유  서울시설공단 청계천관리처 담당구역으로 이송요청드립니다 담당자최세빈 연락처 처리상태  이송이첩 아래 답변이 안보일 경우 위의  민원상세보기원본을 클릭하여 확인해 주시기 바랍니다  연계된 기관에서 처리한 내용으로 궁금하신 사항은 해당 기관으로 문의해야 합니다     ,이송이첩/다부처병렬
 일반 통행로 주행 위반자 단속 부탁드립니다, 성동구 송정동 주민지원센터 앞쪽부터 송원초등학교 정문까지의 구간이 시간제 일방통행입니다 로 기존 에서 시간 줄인 것으로 알고 있습니다 문제는 시간을 줄임과 상관없이 현재 시간제 일방통행이 전혀 지켜지지 않고 있다는 점입니다 가장 큰 이유가 동일로의 혼잡을 피하려는 차들이 자주 이곳을 이용하면서 출근 시간에는 정말 수십대의 자동차가 마치 기차처럼 연달아서 이곳의 일방통행을 어기면서 주행하여 지나온다는 것입니다 이 곳은 주택 밀집 지역으로 길이 좁고 그 좁은 길의 끝에 송원초교의 정문이 있습니다 이곳이 시간제 일방통행이 된 것도 학생들의 등교 시간을 고려한 것으로 알고 있습니다 지금 학교에서도 가장 어린 학년들이 이 길을 통해 등교하고 있습니다 더불어 유치원생들도 이 길을 통합니다 그런데 출근길 얌체 운전을 하는 사람들 때문에 아이들의 안전은 전혀 고려되지 않고 있습니다 차라리 이럴 바에는 시간제 일방통행이 아니라 시간제 보행로로 지정하여 차들의 운행을 막는 것은 어떨지 고민해주시기 바랍니다 그전에는 학교나 경찰서 측에서 이곳을 통제하는 분들을 배치해서 어느 정도 관리라도 됐는데 이제는 그런 단속 조차 전혀 없어서 아예 방치 상태입니다 제가 이 글을 쓰는 지금 이 순간에도 제 눈 앞에서 시간제 일방통행을 어기고 달려가는 차들이 대가 넘습니다 아침 출근길 운전자라면 당연히 단속도 잘되지 않는 길을 통해 조금이라도 원활한 운전을 원할거라 생각합니다 운전자들의 양심에 맡기긴 어려우니 제발 단속을 강화해 주시거나 전자 개폐기로 시간별 차단을 해주시길 간곡히 부탁드립니다,  연계처리내역    민원상세보기원본 추천기관  경찰청 이송추천사유  시간제 보행로 지정 요청 담당자박다미 연락처 처리상태  이송이첩 아래 답변이 안보일 경우 위의  민원상세보기원본을 클릭하여 확인해 주시기 바랍니다  연계된 기관에서 처리한 내용으로 궁금하신 사항은 해당 기관으로 문의해야 합니다     ,이송이첩/다부처병렬
 성동 번 마을 버스의 휴선을 부디 재고해 주십시오, 안녕하십니까 격무에 수고가 많으십니다다름이 아니라 오늘 출근길에 성동 번 버스를 탑승하였는데 월까지만 운행하고 월부터는 휴선에 들어간다는 소식을 들었습니다성동 번 버스는 옥수역  금호동  성수동을 잇는 마을버스로서성동구 주민들의 서울숲 접근을 용이하게 하는 주된 역할을 하고 있으며또한 성수 업무지구로의 출퇴근을 책임지고 있는 우리 구에 꼭 필요한 버스입니다성동 번 버스의 적자 발생에 대해서는 안타깝게 생각합니다만 특히 공공성을 띠는 마을버스가 단순히 어느 자동차운송사업자의 이익에 의존해서만 운영되는 것은 바람직하지 않다고 사료됩니다마을버스란 행정구역에서 기점 종점의 특수성이나 사용되는 자동차의 특수성 등으로 인하여 다른 노선 여객자동차운송사업자가 운행하기 어려운 구간을 대상으로 국토교통부령으로 정하는 기준에 따라 운행계통을 정하여 운영되는 것이 아닌가요그렇다면 성동 번 버스는 안그래도 버스 노선이 타 지역에 비해 극히 부족한 금호동 일대의 특수성을 고려하여 다른 노선 여객자동차운송사업자가 운행하기 어려운 구간즉 적자 등 기타 상황에서 운영되는 것이 마을 버스의 본래 취지에 부합하는 것이라고 사료됩니다더욱이 금호동은 마을버스 뿐만 아니라 간선 지선 버스도 극히 부족한 환경임을 고려할 때 강남 접근성 등을 고려한 간선 또는 지선 버스의 증차는 못할지언정 그나마 있던 마을 버스의 휴선을 실시할 경우 금호동을 포함한 성동구 구민들의 삶의 질은 급격하게 저하될 수밖에 없을 것입니다게다가 원래 성동 번 버스의 배차 간격은 약 분 이상으로 기존에도 배차 간격이 상당히 길어 이용에 어려움이 많았습니다배차 간격이 짧아지는 것은 고사하고 아예 휴선이 된다면 우리 구민의 실생활에 큰 타격을 미치지 않을까 심히 우려스럽습니다부디 성동구민들의 삶의 질 및 생활 환경을 고려하시어 성동 번 버스의 휴선은 재고해주시기를 간곡하게 부탁드립니다,안전건설교통국 교통행정과,안전건설교통국
 성동 번 버스 휴선 반대합니다, 성동 번 버스 휴선 반대합니다지방 지자체읍면에는 하루 몇명 이용하는 버스 노선 및 무료 택시도 운영하는것으로 알고 있습니다서울 중심부 마을버스가 적자를 이유로 폐선하는것이 합리적인지 묻고 싶습니다합리적 판단 바랍니다,안전건설교통국 교통행정과,안전건설교통국
 성동 번 버스 휴선 반대합니다, 수고가 많으십니다매일 이용중인 성동 번 버스가 휴선한다기에 반대 민원 올립니다출퇴근시 이용하는 노선으로 본 노선이 휴선하면 다른 대체 노선이 없는 실정입니다 너그러이 이해해주시기 바라며 휴선 결정 철회 부탁 드립니다,안전건설교통국 교통행정과,안전건설교통국
 성동 번 마을버스 휴선 반대합니다, 안녕하세요년부터 운행되었던 성동 번 버스를 통해 매일같이 출퇴근중인 직장인입니다성동 번이 갑작스래 휴선한다는 내용을 보고 급히 민원 드립니다우선 너무 갑작스러운 통보에 당혹스러웠으며 성동 번 버스 외 다른 옵션이 없는 이용객들이 떠안게 될 부담이 너무 크다고 사료됩니다 경기도는 도민 전체 지원금도 지급하는 마당에 서울사는게 큰 잘못인지 기존 누리던 인프라까지 축소되는 느낌을 받지 않을 수가 없습니다 휴선 반대합니다,안전건설교통국 교통행정과,안전건설교통국
 성동번 마을버스 폐업 반대합니다, 매일 성동번 마을버스로 옥수동에서 성수동까지 출퇴근 하는 성동구민입니다오늘 성동번 마을버스가 없어진다는 소식을 접했습니다지금까지 그 노선이 있어 성수동으로 취업해 다니고 있었는데 너무 어처구니 없이 그 노선을 없앤다는 소식에 너무 당황스럽고 화가나           이렇게 민원을 접수하게 되었습니다그럼 그 노선을 대체할 다른 방법이 있는건가요있다면 그 대체노선을 알고 싶구요 없다면 대체노선 해주세요일방적인 폐업소식 너무 옥수동 주민의 편의를 무시하는것 같네요옥수동에서 성수동 굉장히 가까운 거리인대 이 번 마을버스가 없어지면 버스를 두번에서 세번을 갈아타야 하는 경우가 생깁니다마을버스 폐업 멈춰주세요,안전건설교통국 교통행정과,안전건설교통국
 금남시장 도로변 주차허용 구역에 주차되어 있는 오토바이 단속을 부탁 드립니다,   동일고충민원여부동일고충민원여부       동일고충민원여부 선행민원번호    새창선행민원상세조회,  연계처리내역    민원상세보기원본 추천기관  경찰청 이송추천사유  오토바이 불법주정차 등 민원으로 단속권한이 있는 경찰서로 이송요청합니다 담당자이새롬 연락처 처리상태  이송이첩 아래 답변이 안보일 경우 위의  민원상세보기원본을 클릭하여 확인해 주시기 바랍니다  연계된 기관에서 처리한 내용으로 궁금하신 사항은 해당 기관으로 문의해야 합니다     ,이송이첩/다부처병렬
 응봉역 옆 로타리 곳에 걸린 광고 현수막들 철거, 성동구청 민원 응답소 귀중 안건 응봉역 옆 로타리 곳에 걸린  광고현수막들 철거요망응봉역과 광희중학교 옆에 대단히 아름답게 설계된 응봉동의 명물 쌍둥이 로타리가 개 있습니다 그런데 이곳에 항상 광고물과 홍보물들이 어지럽게 둘러처져 있어서 동네 미관을 몹시 해칩니다 또한 무엇보다 더 큰 문제는 로타리를 돌며 운전할 때 옆이나 앞에서 로타리로 서로 진입하는 다른 차량들이 현수막들에 가려 보이지 않아 교통사고 위험이 매우 큽니다 교통안전 시설인 로타리들을 로터리 설치 목적에 위배되게 광고와 홍보에 사용함으로써 운전자들의 시선과 주의를 혼란시킴을 금지시켜 주십시요 아름다운 응봉동 환경을 보존해주시고 교통사고도 방지해 주십시요 본 민원은 개월 전의 첫 번째 민원에 이어 재차 두 번째로 올리는 것이며 아직 처리결과를 통보받지 못했습니다 대단히 감사합니다 민원인 성동구 고산자로   응봉동 대림강변타운  김성경 드림,도시관리국 도시계획과,도시관리국
 철도 소음, 서울숲리버뷰자이 아파트 거주중인데철도소음이 너무 심합니다 창문을 닫아도 신경쓰입니다철도 속도를 줄이던지 방음벽 설치를 해줘야되는거 아닌가요민원이 많이 발생하는 걸로 알고있는데 어떻게 조치되고있는지 알러주세요,스마트포용도시국 맑은환경과,스마트포용도시국
 안전사고 위험 맨홀 뚜껑이 계속 열려있습니다, 안녕하세요 편의점 앞 맨홀 뚜껑이 계속 열려 있어 안전사고 위험이 있습니다서울특별시 성동구 왕십리로나길 하왕십리동 이마트 상왕십리역점 입니다몇주전 청소 작업 이후로 제대로 닫혀 있지 않아 악취가 심하고 안전사고 발생 우려가 있습니다조치를 취해주시면 감사하겠습니다 첨부파일   ,안전건설교통국 치수과,안전건설교통국
 담배냄새수많은 꽁초때문에 살수가 없습니다, 안녕하세요 성수동 에서 작년부터 거주하고 연무장길로 이사온지는 반년정도 되었습니다 연무장길 자체가 요즘 핫플레이스로 인식되면서많은 젊은이들이 낮시간주말 내내 엄청나게 놀러오는데요 제가 사는 건물은 층엔 사람이 사는 건물이라 시끄러운건 감수하고 살수가 있지만 저희 집 창문 바로 밑에서 담배를 너무 많이 핍니다주변 상가 매장 직원들이 이쪽와서 피면 수시로 뭐라하고 쫓아냈구요 하지만 주말에 몰리는 인파를 제가 감당할수는 없습니다방금 민원실과 통화했는데 법적으로 금연구역 지정되어있는 곳 아니면 벌금이나 신고를 할순 없다고 합니다 그럼 해결할수 있는 방법이 없는걸까요 여름은 창문 닫고 에어컨 틀고 사니까 무시했고 참았습니다 앞으로 창문 열일 많은데 왜 제가 이런 피해를 겪어야 하는지 이해가 안갑니다주말만이라도 금연단속반이 돌아서 단속이라도 해주던지 아니면 상습민원다발구역으로 현수막이나 팻말 엄청 크게라도 걸어주세요 그러면 제가 담배피지말라고 하는 거에 대해서 사람들이 인식이라도 할수있으니까요 그리고 담배피는 행위에는 제지할수 없다고 하시면서 담패 꽁초는 그럼 건물사는 저희가 치워야하는것도 어이가 없습니다제지할 수 없고 막을 수 없으면 그런 구역엔 청소라도 지원을 해주시던지 해야한는 거아닌가요 그로 인해 피해본느 저희 가족은 계속 기침때문에 병원을 다니고 있습니다 지자체에서도 제지할수 없고 어쩔수 없고 판단은 사는 사람이 하는거라고 하시고 너무 어쩌구니가 없는 대답이네요 아무리생각해도 치우는것도 해줄수 없고 그럼 치우는건 피해보는 사람이 해야하는건가요,보건소 건강관리과,보건소
 관내 부동산중개업소내 코로나 관련  고유전화번호 부여및 안내판, 광진구 관내 중개업소에는 코로나 관련   의 전화번호가 사무소 마다 고유 전화번호가 부착되어있어 방문고객이 간단하게  전화 통화하면 방문사실이 등록되어 관리가 편리해 보여서 성동구 관내 부동산 중개업소에도 실행하면 좋을듯하여 의견제시하오니 검토하여 주시기 바랍니다,안전건설교통국 안전관리과,안전건설교통국
 마을버스 정류장 표지판 수리요청,  한신아파트 성동번 버스 정류장 표지판인데 스티커가 너덜거립니다떨어지면 쓰레기로 굴러다닐 것 같은데 높이가 높아 제가 다시 붙이기는 어렵습니다정류장 표지판을 수리해주시길 요청합니다감사합니다현재 상태를 아래 사진으로 첨부하였으며 위치는  정류장입니다 첨부파일   ,안전건설교통국 교통행정과,안전건설교통국
 쓰레기봉투 리터는 구할 수 없나요, 안녕하세요일반 쓰레기봉투 리터 잘 사용하다가 이번에 떨어져서 구매하려고 주위 마트 슈퍼 편의점을 다 돌아도 리터만 판매하고 리터를 판매하지않고 있습니다성수가 동 주민센터에 폐기물관련창구에 가서 물어봐도 유인물을 주면서 직접 전화하고 알아봐야한다해서 가까운 폐기물봉투 파는 지정판매처에 전화해도 없다고 하네요이마트 성수점에 전화해도 판매를 안한다고 답이 왔는데 리터 봉투가 단종되는건가요어디에 파는지 정확한 판매처 좀 알려주시면 감사하겠습니다,복지국 청소행정과,복지국
 살곶이 공원 한양대편 입구 자전거도로 과속방지턱 연속 설치필요, 매번 산책시 살곶이 다리 입구 지하철 철교 아래 교차 지점에서 보행자는 길을 번 건너야 합니다그 구간은 심한 곡선구간이라서 자전거들이 속력을 내서 달리면 보행자나 자전거 탑승자나 모두 위험한 곳입니다과속방지턱을 연속적으로 설치하여 자전거들이 아예 과속을 못하도록 해 주시고가장 좋은 것은 해당 굴곡 구간에서는 아예 자전거에서 내려서 끌고 지나가도록  안전 조치를 하는 것도 어떨까 싶습니다 비용도 별로 안드는 일이고 당장 가을이며 근처 메밀꽃 심어놓은 곳까지 사람들이 들락거릴텐데보행자와 자전거 탑승자 모두가 좁은 길에서 서로 배려하며 지나다닐 수 있도록 조치하시기 바랍니다 첨부파일   살곶이다리앞 자전거 속도감속용연속 방지턱 필요 내려서 가도록 조치살곶이다리앞 자전거 속도감속용연속 방지턱 필요 내려서 가도록 조치,안전건설교통국 치수과,안전건설교통국
