minwon_title,minwon_content,minwon_type,minwon_department
 응봉동 사업 관련, 안녕하세요 저는 응봉동에 거주하고 있는 대입니다요즘 주변 다른 동네에 가 보면 성동구청이 구민들을 위해 다방면으로 힘써주고 계신 것이 느껴집니다 특히 성수동에 가면 유독 감사한 마음을 느낍니다 물론 수요가 많으면 공급도 많아질 수밖에 없다는 것을 알고 있습니다 성수동이 요즘 명소가 되어있다는 것도 인지하고 있습니다 그러나 이러한 지원 정책이 너무 편향적으로 느껴집니다응봉동 주민들은 지금 몇 년째 교통혼잡으로 인해 고통을 매일매일 겪고 있습니다 늘어나는 응봉산 관광객들을 수용할 수 있는 주차장을 만들어달라고 주민들이 몇 차례 요청해보았으나 현실적인 여건이 되지 않는다는 이유로 매번 찬밥신세를 지냅니다 최근 들어서는 감사하게도 응봉산 들어오는 입구 쪽에 통행 관리하시는 분들이 오셔서 교통 통제를 해주시긴 하는데 감독시간이 한정적이고 이러한 주민들의 고통이 근본적으로 해결된 것도 아닙니다 응봉산 정비가 아주 오래 전부터 불과 얼마 전까지도 체계적으로 이루어지는 것을 보았습니다 그만큼 주변 경제도 활성화되었겠고 관광객도 많이 옵니다 하지만 응봉동은 아직 이러한 관광객들을 모두 수용할 만한 그릇이 되지 않습니다그래서 감사하고 죄송한 마음과 함께 다시 한번 고려해 주십사 실질적으로 응봉동 주민이 느끼는 민원을 올립니다  응봉산 교통 통제하시는 분들이 무조건 최소 금토일 시부터 시까지는 차량 단속 업무를 해주셨으면 좋겠습니다 요즘 일정한 시간에 서 계실 때도 있고 안 계실 때도 있더군요 보통 시간이 늦어짐에 따라 차를 끌고 온 관광객이 많아지기 때문에 저 시간대에는 무조건 도와주셨으면 하는 바램입니다 응봉산 주차장 신설이 가능한지 다시 한번 고려해 주셨으면 좋겠습니다 응봉역 옆에 주차장이 있지만 관광객들을 수용하기에는 턱없이 부족하고 매번 길게 줄 서있는 차량들을 보면 안타깝습니다 주차장이 생긴다면 응봉산 관광이 더 활발해질 것이며 성동구에도 무조건 좋은 영향일 것입니다 주차장 신설이 가능하지 않다면 응봉역 출구 신설을 간절하게 바랍니다 서울의 중심에 위치한 응봉산 산책로와 바로 이어진 그리고 명색이 서울 교통의 클러스터 왕십리역과 바로 가까이에 있는 역이 응봉역인데 땅에 닿도록 바로 이어진 출구가 단 하나밖에 없다는 것이 정말 말이 안됩니다 응봉역 번출구에서부터 응봉역 반대쪽 끝까지 걸어오는 시간은 분이 넘게 걸립니다 역 구조를 보면 빗물펌프장 근처에 출구 하나 만들 공간이 아주 부족한 것도 아닐텐데 왜 아직까지도 신설되지 않는지 그렇게 성동구가 돈이 없는지 정말 의문입니다 응봉산 올라가는 골목 근처에 바로 연결된 응봉역 출구가 생긴다면 응봉산 방문을 위해 전철을 이용하는 많은 관광객들의 편의도 살필 수 있을 것입니다 주차장을 만들 예산 여건이 정 안 된다면 응봉역 출구 신설이라도 제발 고려해 주십시오 간곡히 부탁드립니다응봉동 주민들도 실질적으로 도움이 되는 지원 받고 싶습니다 부디 예산을 나누실 때 응봉동도 살피어 주셨으면 하는 바램입니다긴 글 읽어주셔서 정말 감사합니다,  연계처리내역    민원상세보기원본 추천기관  국민권익위원회  이송추천사유  번번 성동구 번응복역출구신설은 서울교통공사로 다부처병렬 요청합니다  담당자김수정 연락처 처리상태  다부처병렬 아래 답변이 안보일 경우 위의  민원상세보기원본을 클릭하여 확인해 주시기 바랍니다  연계된 기관에서 처리한 내용으로 궁금하신 사항은 해당 기관으로 문의해야 합니다     ,이송이첩/다부처병렬
 자동차 공동명의 등록 시 필요사항 질의, 항상 구민을 위해 노력해주셔서 감사합니다다름이 아니라 자동차 공동명의를 등록하려 하는데 가지 질문이 있어 상담민원 신청합니다 구비서류 중 양수인 명의로 책임보험 가입 관련 질문입니다   공동명의는 모친을 지정할 예정이며 자동차 보험은 현재 가족보험부부및직계존비속으로 가입한 상황인데   이 경우 제 명의인 가족보험도 양수인 명의라고 볼 수 있는 건지요 양수인 미 방문시 신분증 사본 혹은 인감증명서 양도증명서에 양수인 도장날인 위임장도장날인 관련 질문입니다   모친에게 별도의 위임을 받아 진행할 예정인데 각종 준비서류에 도장날인만 가능한것처럼 기재되어 있습니다   날인 또는 서명이 아닌 날인만 기재   인감을 찾는 번거로움이 있어 본인서명사실확인서를 발급 받아 서명으로 도장날인을 대신할 수 있는 건지 확인 부탁드립니다감사합니다,안전건설교통국 교통행정과,안전건설교통국
 성동구민종합체육센터 셔틀버스 노선 관련, 안녕하세요성동구민종합체육센터를 이용하고 있는 성동구민입니다성동구민종합체육센터 내 구민 편의를 위한 셔틀버스가 대 정도 운영 중인것으로 알고 있는데성동구 내에서도 옥수동 금호동 노선은 없습니다같은 성동구인데 옥수 금호 노선의 셔틀버스는 없고 행당 응봉 송정 성수 마장 왕십리만 있는데그 이유가 무엇인지 그리고 향후 노선 신설 예정이 있는지도 궁금합니다,행정관리국 문화체육과,행정관리국
 용답초교 앞 어린이보호구역 내 공사 안전하게 부탁드립니다, 안녕하세요저는 성동구 용답초에 두 아이를 보내고 있는 학부모입니다요즘 용답초 주변에 여기저기 공사가 끊이지 않고 있습니다때문에 아이들의 등하교 시에 공사 차량의 이동도 많고 주변 위험물들로 마음 놓고 아이들을 보낸 적이 없는 것 같습니다공사의 소음이나 차량 이동 당연히 주민들이 이해하고 어느 정도는 감안해야 하는 문제입니다하지만 최소한 등하교 시간에 차량 이동이 제한된 구간 내에서 공사 차량이 움직인다던지 잔해들이 아이들을 덮칠지도 모르는 위험한 작업은 피해주실 수는 없을지요오늘 하교길에도 위험천만한 상황을 보게 되었습니다공사 관계자 분들께서 주변에 서 계시기는 하지만 가림막도 전혀 없는 상황에서 잔해나 차량이 뒤로 쏟아진다면 사람의 힘으로는 손 쓸 수 없는 끔찍한 상황이 벌어지지 않을 거라고 어느 누가 장담할 수 있을까요최소한의 안전 장비도 볼 수 없었습니다공사를 막아달라는 민원이 아닙니다 조금만 더 안전한 통학로를 확보해 주십사 요청드립니다현장을 살펴주시고 조치해 주셨으면 합니다 첨부파일    ,도시관리국 건축과,도시관리국
 재개발사업 형평성, 저는 행당제구역재개발조합에년도 부터  제곱미터의 토지의 명의 공동지분소유 조합원입니다 권리가액순으로는 년전 감정평가로 억에 달하는 여섯번째로 평의 큰 토지에 건물을 평씩 지분입니다  이전부터 공유지분의 소유자는 소유면적이 제곱미터 이상이거나 권리가액이 분양용 최소규모 공동주택 가구 추산액 이상인 자는 각각의 분양대상자가 된다는 도정법과 정관에 의하면 면적으로는  제곱미터가 을 지나서 해당이 안되고 권리가액으로는  관리처분계획에는 가구 추산액이 원으로 공유지분권자의 권리가액이 높았으며 사업시행변경에 의해 재분양 신청시 조합은 년이나 지난 감정평가액에 의한 권리가액은 그냥 그대로 두고 가구 추산액을 높혀 원이라 하여 분양대상자 자격을 박탈하는 오류를 범했으며 재개발지역에서 저희처럼 큰 공유자가 없기때문에 모든 조합원이 감정평가룰 다시 못한다면 저희 토지라도 탁상감정해서 비교해야 합리적일 것입니다 자체적으로 감정평가법인을 통해 탁상감정 결과 제곱미터 토지 가치는 금억에 달하여 각각 억에 해당되니 각각의 분양댜상자임이 마땅합니다 국민권익위원회에 민원제기한 후 대전 본사에서 조사관이 직접 와서 조합구청담당자공유조합원 함께 했으나 회의 시작하자마자 조합장님이 바쁘다며 소송하라는 식으로 나가버렸으며 권익위에서는 구청장님의 협조요청을 했으나 구청은 아무런 조치도 전화 한통도 없이 한국부동산원에 타당성 검사의뢰하여 한국부동산원에 전화 신고하고 서류신고 준비중이나 공공관리에 의한 굼싸라기 성동구내 재개발지역에서 태어나 년이상 살아온 고향에서 이렇게 큰땅의 재산을 뺏기는 억울한 조합원이 있음을 사람들에게 구청장님께 알립니다 평빌라도 감정평가액 천만원도 무허가 건물만 갖고 있어도 평대 받고 있는 조합인데 너무나 형평성이 없는분배의 관리처분 아닌가요 이런 일이 거액의 소송비용을 들여 소송으로 해결해야 할 일인지 구청장님 말씀해 주세요,도시관리국 주거정비과,도시관리국
 벽산아파트 정문에서 벽산에 들어가는 골목에 가로등과  달아주세요 큰일날뻔요, 퇴근하고 저녁에 항상 힐스테이트 앞 버스정류장에서 내려 횡단보도를 건넌 후 벽산아파트 정문을 통해 벽산아파트 내부로경동유치원을 낀 골목을 통해 들어갑니다평소에도 거긴 가로등이 있어도 엄청 어둡습니다오늘도 퇴근길에 어두운 그 골목을 들어갈 때만 해도 뒤에아무도 없었는데 갑자기 뒤에서 검정모자를 쓰고 검정자켓과 바지를입은 남자가 모자를 푹 눌러쓰고 뒤에서 걸어와서진짜 갑자기 식은땀 나고 경동유치원 지나서도 어두컴컴한대다 아무도 없어서 어쩌지 하며심장 터지기 직전에 다행히 차가 바로 들어왔고 그 남자가 뒤에 갑자기 멈추다가 다른 방향으로 가버렸어요제 착각일수도 있지만 그 어두컴컴하고 사람 하나 없는 곳에서진짜 엄청난 두려움을 느꼈습니다거기 너무 어두컴컴해요 씨씨티비도 없는거 같아요 있어도 밤엔 어두워서 제대로 나오지도 않겠어요ㅠㅠ제발 그곳에 가로등 추가설치와 좀 달아주세요너무 무섭습니다,도시관리국 공동주택과,도시관리국
 신호위반 차량이 너무 많아서 신호등 건널 때마다 무섭습니다, 마장금호어울림아파트 앞 신호등에서 특히 택시들이 신호 위반을 너무나도 많이 합니다 특히나 새벽 시간대 같은 경우 길을 건너기 위해 신호등을 기다리다가 가려는데 신호 위반 하는 차들 때문에 너무나도 위협을 느낍니다 부디 신호단속카메라를 설치해주세요,  연계처리내역    민원상세보기원본 추천기관  경찰청 이송추천사유  신호단속카메라 설치 요청으로 경찰서로 이송요청합니다  담당자김수정 연락처 처리상태  이송이첩 아래 답변이 안보일 경우 위의  민원상세보기원본을 클릭하여 확인해 주시기 바랍니다  연계된 기관에서 처리한 내용으로 궁금하신 사항은 해당 기관으로 문의해야 합니다     ,이송이첩/다부처병렬
 자전거도로 낙차사고, 수 성동구 자전거 도로에서 자전거가 넘어져 크게 다쳤습니다 동대문구 거주중으로 한강 한바퀴 돌고 귀가하는 중이었고 옆으로 빠른 속도로 추월한 전기 자전거를 피하댜가 자전거 도로 홈에 빠져서 사고가 났습니다 브레이크를 잡고 핸들을 이리저리 돌려봤지만 길게 계속된 홈에서 빠져나올 수 없었고 휘청휘청하다가 결국 넘어졌습니다 양쪽 무릎 온 다리와 어깨에 상처와 멍이 났습니다 물론 지금은 사진처럼 멍색깔이 많이 옅어졌습니다 당일 바로 정형외과로 갔고 걷지말라고 하며 지금까지 계속 통원 치료 받으며 상태를 확인 중입니다 오른쪽 무릎 상처에 구멍이 났는데 피가 찬 것처럼 부어있는 것이 문제라고 합니다 물이나 피가 찰 수 있기 때문에 오늘 기준으로 보름가량은  걷거나 오래 서있지 말라고하며 물도 닿으면 안됩니다 정상생활이 불가능한 지금 저는 매우 고통스럽고 피해가 큰 상태입니다 성동구로 부터 피해보상을 받고 싶습니다 또한 이 구간에서 또다른 자전거 사고가 발생핼 수 있기에 자전거도로의 홈을 조속히 보수해주시길 바랍니다 위치는 사진 참고 바랍니다,안전건설교통국 치수과,안전건설교통국
 새벽 공사 가능한건가요 주 이상 소음 시작 시간을 체크해보았습니다, 집이 공사장 바로 앞 입니다해가 늦게 뜨는 겨울에는 괜찮았는데 봄이 되면서부터 공사장에서 새벽 공사를 하고주중이건 주말이건 자고있다가 새벽에 공사 소음에 잠을 깹니다시반부터 공사 시작하는게 가능한건가요공사장 소음 시작 시간목 시 분금 시토 시 분일 공사안함월 시화 시수 시 분목 시 분 금 시 분 토 시 분 일 공사안함 월 시 분 화 시 분 수 시 분 목 시 분 금 시 분 토 시 분일 공사안함월 시 분화 시 분,스마트포용도시국 맑은환경과,스마트포용도시국
 옆집이  저번에도 그러더니 또그러네요  지하 몇층을 파시는 거죠, 안녕하신가요옆집 도대체 왜 저러는 겁니까또 그러시네지하 몇층을 파시려구 저런데요야 참 진짜집에서도  꿈에서 저렇게 땅을 파시나조상님 무덤도 저런식으로  파신데요지하 몇층을 파시느라구   저런가요담당지 분께서   알려주시든지 하셔야지  이건 뭐    불안해서담당자분께서   지하 몇층을 파는지   답변을 하지 않으시고  그냥   애둘러 이야기만 하시니한국말 못 알아들으시는 공무원은 아니실텐데 담당자분도   혼자서 업무를 다 보십니까다른분은  안계시고 없나요감사합니다수고하시고확실한답변 주세요 첨부파일   옆집 지붕을 이용한 공사 옆집 지붕을 이용한 공사 ,도시관리국 건축과,도시관리국
 한옥으로 집을 다시 지을 경우 나라에서 일억 지원을 받을 수 있습니까, 안녕하십니까한옥으로 집을 짓고 살려면나라에서 지원을 해 주는 일 억을 지원해 준다 라는  한옥 장려 지원을 국가에서 한옥으로 집을 지을 경우  은평구 한옥마을은 아니더라도 일억원을 국가에서 지원해 주는 것으로 알고 있습니다자세한 내용에 대해서 알고 싶습니다여기에 대한 내용을 아시는 분 계시면상세한 답변을 해 주셨으면 합니다일반주택이 아닌 한옥 집으로 짓게 될 경우를 억원을 국가에서 지원  이점 참고하시어 문의를 드립니다한옥 집관련해서 질문을 드렸습니다모르시는 분은 괜히 엉뚱한 답변 하시지 마시기 바랍니다감사합니다수고하세요,  연계처리내역    민원상세보기원본 추천기관  서울특별시 이송추천사유  한옥 지원금 관련으로 한옥정책과로 이송요청합니다 담당자김수정 연락처 처리상태  이송이첩 아래 답변이 안보일 경우 위의  민원상세보기원본을 클릭하여 확인해 주시기 바랍니다  연계된 기관에서 처리한 내용으로 궁금하신 사항은 해당 기관으로 문의해야 합니다     ,이송이첩/다부처병렬
 안전관리과에 공사허가에 질문있습니다  옆집지붕을 넘어공사가 또 진행 중입니다, 안녕하십니까저희 옆집이 지하공사를 하는 모양입니다요번에 또 옆집 지붕을 이용한 공사를 진행 중 입니다이렇게 개인의 지붕을  넘어가 공사를 하도록  허락이 가능합니까그렇게해서라도 공사를 진행할 수 있도록 해 달라고 하던가요있다 없다로 답변 해 주시기 바랍니다 첨부파일   옆집 지붕을 이용한 공사 옆집 지붕을 이용한 공사 ,도시관리국 건축과,도시관리국
 집앞 공사 소음과 진동으로 생활 불편해요, 가림막이나 팬슬 설치도 없이 마구잡이 식으로 공사 진행하는거 같은데 언제까지 참아줘야 하나요소음도 심하고 진동때문에 생활하는데 너무 불편하네요언제까지 참아야 하는지 화가 나네요 첨부파일     ,스마트포용도시국 맑은환경과,스마트포용도시국
 성수문화복지회관 야외계단 폐쇄 신청, 이번 주 토요일과 일요일에 공연이 있었는지  공연이 끝나고 나오는 이용객들이 시간대 별로 야외 계단을 이용하면서아이들이 뛰는 소음과 이용객들의 떠드는 소리 등이  이틀 내내 발생하였습니다또한 주차장이 만차 인지 주택 골목에 차들이 불법 주차하여 승하차를 하니 매우 위험해 보였습니다지난 겨울 코로나로 인하여 야외계단 이용을 폐쇄한다는 안내문이 있었습니다 그때는 바리게이트를 쳐서 야외계단쪽을 이용하지 않으니 이런 소음은 전혀 발생하지 않았습니다오늘도 주택 주민이 조용히 하라고 소리를 지르는 상황이 발생하였습니다언제까지 이런 일이 계속돼야 하는지 이사를 가고 싶을 정도입니다그래서 야외 계단을 겨울 시기처럼  폐쇄하여 주기를 강력히 요구합니다나오는 출구는 엘리베이터나 정문 쪽을 이용하면 됩니다폐쇄하지 않는다면 주민들이 소음방지손해배상소송을 진행하려고 합니다소음 측정도 하고 있는 상태입니다야외계단을 폐쇄하여 주십시요,행정관리국 문화체육과,행정관리국
 뚝섬역 번 출구 앞 노점상 개선이 안되서 다시 올립니다, 수고하십니다예전에 같은 글을 올렸는데 전혀 개선이 되질 않아 다시 올립니다뚝섬역 번 출구에는 노점 행위가 발생되고 있습니다특히 매주 수요일 토요일 오전 시부터 정기적이고 규칙적으로 첨부된 사진과 같이 생필품 노점 행위가 발생되고 있습니다노점판에 앞에는 해당 자재를 싣고 다니는 봉고차를 불법 추차하고 있구요얼마전에는 야외에서 해당 봉고차 문에 락카칠을 한다고 사람이 왕래하는데도 뿌려서 락카 냄새를 본의아니게맡았습니다 지하철을 이용하는 사람들의 보행권을 지켜 주시기 바라며 일회성이 아닌 정기적인 순찰을 해 주시길 바랍니다감사합니다 첨부파일   노점노점,안전건설교통국 교통지도과,안전건설교통국
 성수동 카페거리 주민 생활권 보장해주세요, 날씨가 따뜻해지고 사회적 거리두기 완화로 성수동과 서울숲을 찾는 사람들이 일반 번화가처럼 급격히 증가하였습니다이에 따라 길거리 쓰레기 외부차량 진입 사람들 소음 등으로 카페거리에 거주하고 있는 주민들에게 큰 불편함으로 이어지고 있습니다 주차 문제카페거리 내 주차 공간이 마련되어 있지 않다는 것을 모르는 외지인들이 좁은 골목으로 차를 가지고 들어와 보행자들이나 다른 차량들과의 마찰이 쉽게 일어나는 상황이며 거주민의 주차공간에 주차하는 상황까지 생겨나 큰 불편함을 초래하고 있습니다 외지인들에게 카페거리 내 주차장은 없으며 서울숲 혹은 성동구민체육센터의 공용 주차장을 이용할 것을 적극 홍보해주시길 바라는 바입니다 식당가와 거주 공간의 경계 불명확마구잡이로 재개발 혹은 리모델링이 되는 일이 잦아지면서 소음과 먼지를 일으키는 것은 다반사이며 건물들에 입주하는 카페 식당 등이 주민들의 집과 마주보게 되면서 생활권까지 침해되는 상황에 이르렀습니다 마음 편히 환기를 시키기에도 어려운 상황입니다 상가들에게 생활권이 침해되지 않는 선에서 영업하도록 규정을 만들어주시길 바랍니다당장 곧 여름이 되면 사람들과 차량 소음으로 창문을 열어 둘 수 있을지도 걱정됩니다 성수동을 번화가로만 만드는 데에 열중하지 마시고 년 넘게 거주하고 있는 거주민들의 입장을 생각해주시고 여러 방안을 마련해주세요감사합니다,안전건설교통국 교통지도과,안전건설교통국
